key,method,family,authors,year,venue,doi,pmid,citations,measured_effects,feasibility_verdict,certificate,infeasibility,heldout_validation,combinatorial,druggability,input_type,output_type,limitation,one_line_delta,cohort
Wenkel2026,TxPert,Perturbation-response prediction,"Frederik Wenkel, Wilson Tu et al.",2026,Nature Biotechnology,10.1038/s41587-026-03113-4,42067667.0,1.0,partial,no,no,no,yes,partial,no,perturbation identity + multiple biological knowledge graphs,predicted transcriptomic perturbation effects using KG priors (forward prediction),KG-guided predictor; relies on inferred/curated graph priors and emits no feasibility certificate,TxPert predicts effects using knowledge-graph priors; we use measured effect vectors (not priors) and return a geometric feasibility verdict.,2025-2026
Atti2025,"Foundation Model Benchmarking Study (scGPT/scGPT-like, Geneformer, Seurat v5)",Foundation model,"Srijan Atti, Shankar Subramaniam",2025,bioRxiv (Cold Spring Harbor Laboratory),10.1101/2025.06.26.661767,,5.0,no,no,no,no,partial,no,no,"unperturbed scRNA-seq (Myeloid, hPancreas) + Gaussian-noise-perturbed expression values",cell-type classification prediction,"correlational classifier trained on unperturbed transcriptomic embeddings/tokenization artifacts (binning, rank encoding); no causal or perturbation-effect model, no notion of reachable state space or minimal intervention","This study only measures whether foundation-model embeddings can classify cell types under noise, whereas our oracle uses measured knockdown effect vectors to give a falsifiable reachability verdict—returning a minimal perturbation recipe or a Farkas infeasibility certificate naming genes to activate—something this classification benchmark neither attempts nor can produce.",2025-2026
Fu2025,GET (general expression transformer),Foundation model,"Xi Fu, Shentong Mo et al.",2025,Nature,10.1038/s41586-024-08391-z,39779852.0,98.0,no,no,no,no,yes,partial,no,chromatin accessibility + motifs across human cell types,predicted transcription / regulatory activity; cell-type-general expression model (forward prediction / embedding),predicts expression from regulatory state; cannot certify reachability of a target state or emit an infeasibility proof,GET forward-predicts expression from regulatory inputs; our oracle answers the inverse feasibility question over measured perturbation effect vectors.,2025-2026
Kalfon2025,scPRINT,Foundation model,"Jérémie Kalfon, Jules Samaran et al.",2025,Nature Communications,10.1038/s41467-025-58699-1,40240364.0,36.0,no,no,no,no,yes,no,no,single-cell transcriptomes (~50M cells) for gene-network inference,cell embeddings + inferred gene networks (embedding + GRN),infers networks/embeddings; does not compose measured effects into a feasibility verdict,scPRINT infers networks from expression; we bypass inferred GRNs and reason directly over measured knockdown effect vectors to certify reachability.,2025-2026
Pearce2025,TranscriptFormer,Foundation model,"James D Pearce, Sara E. Simmonds et al.",2025,bioRxiv (Cold Spring Harbor Laboratory) [preprint],10.1101/2025.04.25.650731,,27.0,partial,no,no,no,yes,no,no,cross-species single-cell transcriptomes (generative cell atlas across ~1.5B years of evolution),generative cell-state model / embeddings across species (forward generation / embedding),cross-species generative atlas; no perturbation-reachability formalism or certificate,TranscriptFormer generatively models cell states across species; we certify reachability of a target shift from measured perturbations in one system.,2025-2026
Qiu2025,GRNFormer,Foundation model,"Mufan Qiu, Xi-Jiang Hu et al.",2025,arXiv (Cornell University),10.48550/arxiv.2503.01682,,0.0,no,no,no,no,yes,no,partial,unperturbed scRNA-seq + multi-omics-inferred GRN priors,embedding,"relies on inferred GRN structure from correlational multi-omics data, not measured perturbation effects, and offers no feasibility proof or minimal intervention recipe","GRNFormer learns an embedding from inferred regulatory graphs to improve forward prediction accuracy, whereas our oracle uses measured CRISPRi effect vectors to issue a provable reachable/infeasible verdict with a minimal knockdown recipe or Farkas certificate naming genes to activate.",2025-2026
Rizvi2025,"C2S-Scale (Cell2Sentence, scaling LLMs)",Foundation model,"Syed Asad Rizvi, Daniel Lévine et al.",2025,bioRxiv (Cold Spring Harbor Laboratory) [preprint],10.1101/2025.04.14.648850,41279114.0,32.0,partial,no,no,no,yes,partial,no,single-cell expression rendered as gene 'sentences' for large language models,LLM-based single-cell analysis incl. perturbation-response generation (forward prediction / text),LLM sequence modelling of cells; cannot prove a target state is outside the achievable set,"C2S-Scale generates perturbation responses via an LLM; our oracle gives a geometric, falsifiable feasibility certificate instead of a generated guess.",2025-2026
TejadaLapuerta2025,Nicheformer,Foundation model,"Alejandro Tejada-Lapuerta, Anna C. Schaar et al.",2025,Nature Methods,10.1038/s41592-025-02814-z,41168487.0,51.0,no,no,no,no,yes,no,no,dissociated + spatial single-cell omics (large pretraining),cell/niche embeddings for spatial and single-cell tasks (embedding),"foundation embedding model; no measured-effect geometry, no feasibility certificate",Nicheformer represents cells and niches; our oracle turns measured perturbation effects into a reachable/infeasible decision with a recipe.,2025-2026
Wang2025scGPTspatial,scGPT-spatial,Foundation model,"Chloe Xueqi Wang, Haotian Cui et al.",2025,bioRxiv (Cold Spring Harbor Laboratory) [preprint],10.1101/2025.02.05.636714,,37.0,partial,no,no,no,yes,no,no,single-cell + spatial transcriptomics (continual pretraining of scGPT),spatially-aware cell embeddings / imputation (embedding; forward tasks),spatial foundation model; no perturbation-cone geometry or feasibility verdict,scGPT-spatial embeds spatial cell states; we compute whether a desired state shift is reachable by combining measured knockdowns.,2025-2026
Zeng2025,CellFM,Foundation model,"Yuansong Zeng, Jiancong Xie et al.",2025,Nature Communications,10.1038/s41467-025-59926-5,40393991.0,59.0,partial,no,no,no,yes,no,no,"single-cell transcriptomes (~100M cells, large pretraining corpus)",cell embeddings / representations for downstream tasks (embedding; forward tasks),"an embedding/foundation model; no geometry over perturbation effects, no feasibility verdict",CellFM embeds cells for prediction; our method operates on measured knockdown effect vectors to return a reachable/infeasible verdict.,2025-2026
Bai2026a,scLong,Foundation model,"Ding Bai, Shentong Mo et al.",2026,Nature Communications,10.1038/s41467-026-69102-y,41639087.0,5.0,no,no,no,no,yes,partial,no,unperturbed scRNA-seq (48M cells) + GO gene-graph priors,embedding / forward prediction of perturbation response,"learned correlational embedding over inferred/attention-based gene context, not measured causal effect vectors; no convex-cone structure, no minimal-recipe or infeasibility certificate for reaching a target state","scLong forward-predicts expression responses via a large attention/GNN model trained on correlational scRNA-seq data, whereas our oracle uses measured CRISPRi effect vectors as convex-cone generators to return a falsifiable reachable/infeasible verdict with a minimal knockdown recipe or a Farkas certificate naming genes needing activation.",2025-2026
Demir2026,CellxPert,Foundation model,"Andaç Demir, Erik W. Anderson et al.",2026,arXiv (Cornell University),10.48550/arxiv.2605.00930,,0.0,partial,no,no,no,yes,partial,no,"multi-omics single-cell + spatial data (scRNA-seq, ATAC-seq, CITE-seq, MERFISH, IMC)",prediction/trajectory (embedding + predicted transcriptomic response to given perturbations),"learned foundation-model prior over tokenized expression states, not measured perturbation effects; no convexity structure, so cannot certify whether a target state is reachable or return a minimal/necessary gene set","CellxPert stochastically samples plausible forward transcriptomic trajectories from a learned masked-language-model prior, whereas our oracle uses measured CRISPRi effect vectors to build a convex cone and returns a provable verdict—reachable with minimal knockdown recipe, or infeasible with a Farkas certificate naming genes to activate instead.",2025-2026
Alatkar2025,ARTEMIS,Virtual-cell / large perturbation model,"Sayali Alatkar, Daifeng Wang",2025,Bioinformatics,10.1093/bioinformatics/btaf218,40662824.0,3.0,no,no,no,no,yes,no,no,"time-series scRNA-seq (unperturbed, snapshot timepoints)",trajectory + embedding + drift-gene ranking,"relies on a learned SDE/VAE dynamics model fit to unperturbed time-series, not measured perturbation effects, so it can only simulate forward outcomes with no reachability proof or minimal recipe","ARTEMIS forward-simulates continuous expression/population dynamics from a learned generative model of unperturbed time-series, whereas our oracle uses measured CRISPRi effect vectors in a convex cone to return a falsifiable reachable/infeasible verdict with a minimal knockdown recipe or Farkas certificate naming genes to activate.",2025-2026
Qian2025,Grow AI virtual cells (position/roadmap),Virtual-cell / large perturbation model,"Liujia Qian, Zhen Dong et al.",2025,Cell Research,10.1038/s41422-025-01101-y,40128605.0,40.0,partial,no,no,no,no,no,no,perspective — multi-omics data pillars + closed-loop experimental design,roadmap/position paper for building AI virtual cells (no method output),conceptual roadmap; provides no falsifiable feasibility test,This roadmap calls for predictive virtual cells; our oracle is a concrete falsifiable step — a convex-geometry reachability verdict from measured perturbations.,2025-2026
Roohani2025,Virtual Cell Challenge,Virtual-cell / large perturbation model,"Yusuf Roohani, Tony J. Hua et al.",2025,Cell,10.1016/j.cell.2025.06.008,40578317.0,59.0,partial,no,no,no,yes,no,no,"community benchmark: perturbation + context inputs, held-out perturbation-response evaluation",challenge/benchmark defining a Turing-test-style evaluation for virtual-cell perturbation prediction,scores predictive accuracy only; no notion of a reachable set or an infeasibility certificate,"The Challenge measures how well models predict perturbation effects; we instead certify whether a target shift is reachable at all, and if not, which genes must be activated.",2025-2026
Chen2026,"SCALE (set-aware flow, conditional transport)",Virtual-cell / large perturbation model,"Shuizhou Chen, Lang Yu et al.",2026,arXiv (Cornell University),10.48550/arxiv.2603.17380,,0.0,partial,no,no,no,yes,no,no,"unperturbed scRNA-seq + perturbation identity (genetic/chemical/cytokine), trained on Tahoe-100M",prediction (predicted perturbed expression distribution/endpoint),"forward generative/transport model over learned latent space—correlational, no reachability proof, no minimal perturbation recipe, no infeasibility certificate","SCALE learns a flow-based transport map to forward-predict cell states from given perturbations, whereas our oracle uses measured knockdown effects as convex-cone generators to issue a falsifiable reachable/infeasible verdict with a minimal recipe or Farkas certificate naming genes to activate instead.",2025-2026
Mao2026,VCBench (VC benchmarking framework),Virtual-cell / large perturbation model,"Xinjie Mao, Songming Zhang et al.",2026,arXiv (Cornell University),10.48550/arxiv.2604.27646,,1.0,partial,no,no,no,yes,no,no,perturbation datasets (Perturb-seq/scRNA-seq) + candidate VC models,ranking,"purely an evaluation harness for forward-predictive models trained on inferred/correlational associations; no reachability semantics, no minimal recipe, no infeasibility proof","VCBench scores how well forward-predictive VC models forecast known perturbation outcomes, whereas our oracle answers reachability directly from measured effects, returning either a minimal knockdown recipe or a Farkas infeasibility certificate naming genes to activate—a falsifiable verdict no benchmarked model produces.",2025-2026
Vollenweider2026,"SBB Principles (Signal, Bounds, Baselines)",Virtual-cell / large perturbation model,"Michael Vollenweider, Peter Bühlmann",2026,bioRxiv (Cold Spring Harbor Laboratory),10.64898/2026.04.20.719650,,1.0,partial,no,no,no,yes,partial,no,predicted vs ground-truth transcriptomic perturbation datasets (single and double perturbations),calibrated evaluation metrics / diagnostic scores / baseline benchmarks,"it is an evaluation/benchmarking framework for scoring other forward-prediction models' outputs, not a predictive or reachability system itself; produces no recipes, no feasibility verdicts, no certificates - only calibrated performance metrics","SBB is a metrics-and-baselines framework for judging how well forward-prediction models score, whereas our oracle is itself a decision system that returns a falsifiable reachable/infeasible verdict with a minimal knockdown recipe or a Farkas infeasibility certificate derived from measured convex-cone effects.",2025-2026
Wang2026,AROMA,Virtual-cell / large perturbation model,"Zhenyu Wang, Geyan Ye et al.",2026,arXiv (Cornell University),10.48550/arxiv.2604.20263,,0.0,no,no,no,no,yes,partial,no,"textual evidence + graph-topology (knowledge graphs) + protein sequence features, multimodal",prediction,"relies on inferred multimodal knowledge (text/KG/sequence) rather than measured perturbation effects; no convex-cone structure, no minimal recipe, no infeasibility proof - purely correlational/retrieval-based reasoning","AROMA produces LLM-style reasoning-augmented forward predictions of perturbation response from heterogeneous knowledge sources, whereas our oracle uses measured CRISPRi effect vectors in a convex cone to return a falsifiable reachable/infeasible verdict with a minimal knockdown recipe or a Farkas certificate naming genes needing activation.",2025-2026
Zhang2026,Lingshu-Cell (masked discrete diffusion world model),Virtual-cell / large perturbation model,"Han Zhang, Guo-Hua Yuan et al.",2026,arXiv (Cornell University),10.48550/arxiv.2603.25240,,0.0,partial,no,no,no,yes,partial,no,"unperturbed + perturbed scRNA-seq (Perturb-seq, cytokine panels) with cell type/donor identity, ~18k-gene discrete tokens",generative prediction / distribution simulation,"correlational generative model over learned latent token distribution, not measured non-negative-effect cone; cannot certify infeasibility or return minimal knockdown recipes","Lingshu-Cell forward-simulates plausible transcriptomes for given perturbations via a learned diffusion prior, whereas our oracle answers reachability directly from measured CRISPRi effect vectors, returning either a minimal knockdown recipe or a Farkas/KKT certificate proving a target state is unreachable and naming genes to activate instead.",2025-2026
Gonzalez2025,Causally-inspired combinatorial perturbation prediction,Combinatorial data / OT / design,"Guadalupe Gonzalez, Xiang Lin et al.",2025,Nature Biomedical Engineering,10.1038/s41551-025-01481-x,40925962.0,18.0,partial,no,no,no,yes,yes,no,single/paired perturbation data + causal structure priors,predicted effects of combinatorial therapeutic perturbations + candidate ranking (forward prediction/ranking),ranks candidate combinations by predicted effect but cannot prove a target state is outside the achievable set,Gonzalez et al. rank predicted combinations; our oracle proves reachability and returns the minimal knockdown set or a Farkas certificate of infeasibility.,2025-2026
Klein2025b,moscot (multi-omics single-cell optimal transport),Combinatorial data / OT / design,"Dominik Klein, Giovanni Palla et al.",2025,Nature,10.1038/s41586-024-08453-2,39843746.0,127.0,partial,no,no,no,yes,no,no,"multimodal single-cell/spatial/temporal genomics data (scRNA-seq, ATAC, spatial transcriptomics, time series)",trajectory / alignment / mapping / embedding,"unsupervised correlational coupling of observed states, not a causal perturbation model—no perturbation vectors, no combination logic, no notion of a reachable set or infeasibility, and no minimal intervention recipe","moscot aligns and interpolates observed cell distributions across time/space via optimal transport couplings, whereas our oracle uses measured CRISPRi effect vectors as generators of a convex cone to give a falsifiable reachable/infeasible verdict with a minimal knockdown recipe or Farkas certificate naming genes to activate instead.",2025-2026
Driessen2026,CAR-OT (conditional optimal transport for CAR response),Combinatorial data / OT / design,"Alice Driessen, Jannis Born et al.",2026,Cell Systems,10.1016/j.cels.2026.101591,42025164.0,1.0,partial,no,no,no,yes,partial,no,scRNA-seq of CAR-T cells expressing diverse CAR variants + protein language model embeddings of CAR sequence/design,prediction,"correlational forward generative model over inferred transport maps between distributions; no reachability proof, no minimal perturbation recipe, no infeasibility certificate","CAR-OT forward-predicts transcriptomic shifts for a given CAR design via learned optimal transport, whereas our oracle inverts measured knockdown effects to prove reachability or issue a Farkas infeasibility certificate naming genes to activate, with a minimal recipe when feasible.",2025-2026
AhlmannEltze2025,Linear-baseline benchmark of perturbation models,Benchmark / other,"Constantin Ahlmann-Eltze, Wolfgang Huber et al.",2025,Nature Methods,10.1038/s41592-025-02772-6,40759747.0,96.0,yes,no,no,no,yes,partial,no,genetic Perturb-seq datasets; compares deep models vs simple linear/additive baselines,"critical benchmark finding (evaluation, not a predictor)","a benchmark, not a method; but its headline supports honest positioning of any predictive model",Ahlmann-Eltze et al. show deep predictors barely beat linear baselines — motivating our shift from accuracy-chasing prediction to a falsifiable geometric feasibility verdict.,2025-2026
Csendes2025,Benchmark of foundation models for post-perturbation RNA-seq,Benchmark / other,"Gerold Csendes, Gema Sanz et al.",2025,BMC Genomics,10.1186/s12864-025-11600-2,40269681.0,34.0,no,no,no,no,yes,no,no,foundation-model predictions of post-perturbation bulk/pseudobulk RNA-seq,benchmark finding (evaluation),"benchmark, not a method; supports honest positioning","Csendes et al. find foundation models weak at post-perturbation prediction — motivating a method that returns certificates, not just predictions.",2025-2026
Kedzierska2025,Zero-shot evaluation of single-cell foundation models,Benchmark / other,"Kasia Z. Kedzierska, Lorin Crawford et al.",2025,Genome biology,10.1186/s13059-025-03574-x,40251685.0,65.0,no,no,no,no,yes,no,no,"single-cell foundation-model embeddings (scGPT, Geneformer, etc.)",critical benchmark of zero-shot embedding quality (evaluation),"benchmark, not a method; documents foundation-model limitations relevant to honest positioning",Kedzierska et al. show foundation-model embeddings underperform simple baselines zero-shot — reinforcing our choice of measured effects and explicit geometry over learned embeddings.,2025-2026
Kernfeld2025,Comparison of expression-forecasting (perturbation) methods,Benchmark / other,"Eric Kernfeld, Yunxiao Yang et al.",2025,Genome biology,10.1186/s13059-025-03840-y,41250104.0,6.0,partial,no,no,no,yes,partial,no,perturbation datasets; comparison of expression-forecasting/in-silico perturbation methods,benchmark/comparison finding (evaluation),"benchmark, not a method; documents modest predictive gains",Kernfeld et al. document weak forecasting gains; our oracle offers a categorically different output — a geometric feasibility certificate.,2025-2026
Luecken2025,Open Problems in single-cell analysis (benchmark platform),Benchmark / other,"Malte D. Luecken, Scott Gigante et al.",2025,Nature Biotechnology,10.1038/s41587-025-02694-w,40595413.0,31.0,partial,no,no,no,yes,partial,no,community benchmarking platform incl. perturbation-prediction tasks,standardized open benchmarks + leaderboards (evaluation infrastructure),"benchmark platform, not a method; no reachability formalism",Open Problems standardizes forward-prediction benchmarks; our contribution is a new output type (a feasibility certificate) that such accuracy benchmarks do not score.,2025-2026
Vinas2025,Systema,Benchmark / other,"Ramón Viñas, Maciej Wiatrak et al.",2025,Nature Biotechnology,10.1038/s41587-025-02777-8,40854979.0,31.0,partial,no,no,no,yes,no,no,genetic-perturbation datasets; standardized evaluation of perturbation-response predictors,benchmark framework + finding (evaluation),"benchmark, not a method; supports our positioning that forward accuracy alone is weak",Systema exposes weak generalisation of perturbation predictors; we sidestep the accuracy race by returning a falsifiable reachability certificate.,2025-2026
Wei2025,Benchmark of generalizable single-cell perturbation prediction,Benchmark / other,"Zhiting Wei, Yiheng Wang et al.",2025,Nature Methods,10.1038/s41592-025-02980-0,41381899.0,15.0,partial,no,no,no,yes,partial,no,single-cell perturbation datasets across contexts,benchmark of algorithms for generalizable perturbation response (evaluation),"benchmark, not a method; documents generalisation gaps",This benchmark measures predictive generalisation; our oracle instead delivers a provable reachable/outside verdict from measured effects.,2025-2026
Wu2025,Biology-driven insights into single-cell foundation models,Benchmark / other,"Jialu Wu, Qing Ye et al.",2025,Genome biology,10.1186/s13059-025-03781-6,41044630.0,15.0,no,no,no,no,partial,no,no,single-cell foundation models evaluated on biologically-motivated tasks,critical evaluation of when foundation models add biological value (evaluation),"evaluation, not a method; supports honest positioning","Wu et al. question the added biological value of foundation models; we deliver an explicit, falsifiable geometric result rather than a learned representation.",2025-2026
Zhang2025Tahoe,Tahoe-100M,Benchmark / other,"Jesse Zhang, Airol A Ubas et al.",2025,bioRxiv (Cold Spring Harbor Laboratory) [preprint],10.1101/2025.02.20.639398,,85.0,yes,no,no,no,partial,no,no,"giga-scale scRNA-seq of ~100M cells across 50 cell lines x 1,100+ drug treatments (dataset resource)","perturbation atlas / training corpus + context-transfer benchmarks (dataset, not an oracle)","a dataset, not a method; supplies measured drug responses but no geometry or feasibility reasoning over them",Tahoe-100M is the measured-response substrate; our contribution is the convex-cone geometry that turns such measured effect vectors into a falsifiable reachability verdict.,2025-2026
ThisWork,Convex-cone reachability oracle (this work),Reachability oracle (this work),This work,2025,—,,,,yes,yes,yes,yes,yes,partial,yes,Measured CRISPRi/CRISPRa effect vectors (differential-expression signatures) from a genome-scale Perturb-seq screen,Falsifiable reachable / provably-outside-the-cone VERDICT + minimal recipe + activation certificate,"Linear-additivity of co-perturbations is a bounded approximation (epistasis untested at scale); LOF cone cannot supply activation, surfaced honestly as the certificate",—,this work
